Ratings ,Title,Reviews,
2,Overpriced and extremely mediocre,"Such a mediocre hotel asking high prices. Stayed two nights this past weekend, Friday and Saturday. One of the key requirements for the hotel was having late night in room dining because we were going to be coming back very late and Napa is obviously an early closing town. The hotel website (edit, see here, dated 6/2015: solagecalistoga.com/wp-c…) and the front desk confirmed there was in room dining available 24 hours - it specifically says so on the fact sheet and in the hotel details! Of course, when we tried to order, not only was nothing available but the attendant didn't even try to help. Instead, the rude person on the phone said - why don't you just wait till tomorrow! False advertising at its finest.

Next morning, 8:30am, rudely awakened by housekeeping banging on the door of the 'studio' (which, by the way, has no privacy - there are people walking by right outside on your 'patio') and the walls are paper-thin. I asked housekeeping to come back later, but could still hear them cleaning/talking in the adjoining room. Of course when I returned at the end of the day, the room hadn't been cleaned. I told the front desk about this at checkout -- the guy just shrugged and said 'well, I think you'll get an email asking for feedback'

This is one of those 'trying to be hip' properties that can't even get the basics right - and the attitude is just insufferable. Auberge, which is a fantastic property, recently sold their stake in this one - perhaps that's where the service and quality went downhill. Many better places to stay in the area - Auberge, Merrywood, or even a charming b+b - at least they promise what they can deliver, unlike this place. Stay far away!!!",
4,"Modern and Beautiful Property, Slightly Overpriced","Pulling up to Solage, you are greeted by beautiful, native California landscape and immediately treated to excellent service. The valet attendant brought us water and checked us in without ever having to leave our car! He then escorted us to our room, carried in our bags (including a case of wine we picked up from a winery on our way from the airport), asked us if we had any questions and politely made himself scarce (which is our preference).

We stayed in a Vega Studio room, which is located near the adult swimming pool. (We got lucky in that our room was not immediately next to the pool, but several villas away to avoid the noise.) The decor is minimalist and modern, which we love, the bed complete with high quality linens and comfortable mattress, and the room also includes a lovely outdoor sitting area that is semi-enclosed with native plantings. So far, so good.

Where we took issue, is that the bathroom (which has an open plan into the bedroom - we love that and don't mind) did not include double sinks nor a bathtub. For a resort of this caliber and when paying $500+ per night we expected those amenities at a minimum. The layout is actually quite good, but where there is a perfect spot for a soaking tub across from the sink, there is instead a bench with cushions which doesn't really serve any functional purpose. Then there is the issue of the sink. There is a large stone counter which is big enough to accommodate two sinks, but only one is present and pushed over to one side. I suppose for those people who have a lot of toiletries, jewelry or makeup, the counter space is necessary. But, we would have sacrificed the counter space so we didn't have to brush our teeth or wash our hands in turns. A small thing, but one that is worth mentioning for a luxe resort such as this.

Aside from that, the grounds are incredibly lovely though not as lush as other resorts in this price point where we've stayed. I actually appreciated that, as we are in a long drought here in CA and the plants at Solage don't require much water to thrive. Also, Solbar (the on site restaurant) is very good and occasionally worth the splurge (resort prices). Venturing out into Calistoga is easy and quick, as Solage provides each room with two free bicycles, and there are plenty of choices for top quality dining there as well.

Definite perks for staying here are the included use of not only the adult pool (which is HUGE and can get a bit sceney on the weekend), but also a very nice gym facility and mineral pools / baths in the spa. No charge for those pools or the use of the steam room, which is nice for those who want to relax away from the pool scene and use some of the facilities without having to pay for a spa treatment.

Initially, we thought the stay was very overpriced for what it was, but after visiting some other properties in the area it is actually pretty reasonable. The area is just very expensive and we'd much rather pay the extra $100 or so to stay at Solage than at another property that's not nearly as nice or updated for that much less.

Overall, we'd love to go back, but will be looking for a deal on Jetsetter or other travel discount site to take advantage of some savings.",
5,Great Visit!,"We stayed last week on the Girls Getaway and had fantastic time!!

The service was great--the pool service was perfect. Loved having access to the bikes and being able to ride into town. Meals and drinks at SOLBar were great.
We shipped our Wine back via the hotel and it was convenient to not have to hassle with it.
The small touches like turn down service were nice.

Only complaint is the shower pressure is terrible. I questioned it--and was told that it was due to the drought.

I would return and recommend to others! Love that it was off the beaten path from ""napa""--- had a laid back vibe--and was surrounded by great wineries!",
5,Excellent service!!!,"I came two separate times to solage while visiting friends in the area and every time the staff was so helpful and friendly! Our server both times was magnificent! Attended to every need w a smile and my friends can be admittedly a lil needy. The sex in the vineyard cocktail was magnificent, the Hefeweizen-one of the best I've ever had & ricotta pancakes at brunch were heavenly! Surely worth every penny!",
5,"Lovely grounds and excellent restaurant, but rooms are sterile","Great service--we were greeted right away by two strong men who drove us right up to our suite with luggage, camera case, etc. They were very helpful and made us feel special. Service is a plus! But after spending $800 on a room, I'd like it to feel sunny and warm. Instead, the room was dark and kind of gloomy. That said, all the features were top notch -- the shower and tile surround, the tub and extra-wide flat screen TV really scored. Also appreciated the organic chocolate on the pillows at night. Your best bet is to make reservations at Solbar for dinner and lie down by the amazingly refreshing pool. We had a salad in our chaise lounges, and there's no shortage of cold drinks of all stripes and colors.",
4,Relaxed Napa Valley Escape,"We spent four nights here in July, our room was very comfortable and well designed. The fairly private covered terrace was a nice feature. Prior to arrival the concierge provided good advice on dining options in the valley and vineyards to visit. The gym was very busy in the morning, we had to wait for the treadmills. There are some exercise classes but more high intensity as opposed to yoga and mat Pilates classes would have been preferable. The location is an excellent base to explore the region and is beautifully sited and landscaped. The only shortfall is the dining, we had three breakfasts and one dinner in the restaurant and were disappointed every time. The food falls very short of the excellent staff and service. In general we loved the style of the resort and the relaxed feeling.",
5,Look for the overnight deals,"Solage is a beautiful property about 2 hours from San Francisco in Calistoga. The rooms are clean and have small patios. Some patios are more private than others. The gym is really nice and they offer various classes. If you want to go for a night, you can save money and experience it by keeping your eyes open for last minute deals. Or you can go for a while and fully relax. There are excellent wineries around the hotel and the Silverado Trail is one of the most beautiful areas up North. The service is top notch and it is one classy and clean hit hotel.",
5,Napa's Most Charming resort,"We just returned from a wonderful week in Napa and we started the holiday with 3 nights at the stunning Solage in Calistoga. We HIGHLY recommend this place. Beautiful surroundings - mountain ranges, easy walk or bike ride to charming town of Calistoga. Gourmet dinner at Solbar. Yummy breakfasts outside. swam daily in the pool.",
5,"Luxurious, tranquil, simplicity at it's best!","Solage Calistoga is my new favorite resort. It was my first stay here and I will definitely be back!!! I LOVED everything about it. I love how you have your own individual cabanas (rooms) which adds to the peaceful ambience and the feeling of getting away from everything. The rooms are contemporary, nicely decorated, very comfortable, and a perfect size. Great bathrooms, beds, sheets, pillows, and chairs to sit on both inside and outside your room. You have your own private patio to enjoy a bottle of wine. The entire place is laid back but designed with a simple elegance, beautiful pathways connecting to the pool, restaurant and spa. The landscape is amazing....very well designed. Breakfast, lunch and dinner are all DIVINE at their Michelin rated restaurant and I loved the interior decoration of the restaurant as well as sitting outside by the fire under the canopy of trees. Spa is amazing, and I practiced yoga (on my own) in their exercise room (between classes) and loved the setting. We spent time by the pool, the spa, and riding bikes around the property. This is the kind of place that you never want to leave during your entire stay. Lastly the service can't be beat! Every single person who works here from the moment you check in, to the bell boy, to the maids, to the hostess and waiters in the restaurant, were not only professional but very friendly and definitely were a big contributing part to the perfection of our experience here. My husband and I were wanting to unwind and just spend time together and we couldn't have picked a better setting. Definitely my favorite place to stay in the entire Napa Valley area!",
5,Luxurious Wine Country Retreat,"We just returned from our third stay at Solage Calistoga and had another outstanding time. The facilities are great and the relaxed atmosphere really helped us unwind and truly enjoy.

The large rooms are furnished comfortably with a well designed modern bathroom/dressing room area, and a private patio. Small touches in the room made our stay even better. There’s a coffee maker, two canisters of ground coffee (regular and decaf), an iPad you can use to order food and other services, and wine glasses. The room’s large sliding doors open up to a private patio with comfortable furniture. It’s a perfect spot to relax in the morning and have a leisurely breakfast. The King bed is so comfortable it will instantly put you to sleep. Most importantly the room was spotless and the housekeeping is one of the best I’ve ever encountered. Everyday my toiletries were organized, towels neatly folded, glasses replaced, and we when we reentered the room everyday it looked like how it was when we first arrived.

We spent a lot of time by the large swimming pool basking in the sun. The place never felt crowded and we were able to secure chairs every time. The poolside service was efficient, pleasant, and attentive. Every staff member we encountered went above and beyond to make sure we were well cared for.

Other highlights were: the complimentary bottle of house wine from Solbar due to an unusual long wait, poolside service handing out iced treats, watching the Women’s World Cup by the pool, the spa facilities. I can go on and on.

This is an example of a hotel with amazing attention to detail, excellent service and impeccable style and design. There are so many places to visit in the world that I try to explore new rather than return to old, but Solage Calistoga is a place where I would return again and again to unwind.",
5,Superb spa in Calistoga,A place to have a couples time. We had a mud sllide and a few other services plus a time in the pool early enough to have a cabana. Try it a second day. Wonderful. We did not stay at the hotel but the spa services will exceptional as well as the facilities and the attention. We had massages on the second day. Will return.,
5,Luxury and tranquility - stunning place,"After a week of travelling the Pacific highway we arrived at the Solage. From the moment we checked in we felt we had arrived somewhere special. A warm welcome and iced tea served to us before being escorted to our lovely studio. The rooms are gorgeous, well appointed, good size & layout and extremely comfortable, I slept so well. The attention to detail in the amenities was excellent, fresh coffee, milk in the fridge, full size spa quality bathroom products, I especially loved the turndown service with the gorgeous bottles of mint water. During our stay we had a couples mud treatment in the spa which started off quite humorous throwing mud at each other but we soon chilled out and relaxed into the experience, my other half even fell asleep at the end. During our three day stay we used all the facilities, we even went on a bike ride which was fun. Quite simply we loved everything, the food, the wine, the spa and the service itself was always courteous and friendly. We were so chilled that we honestly didn't want to leave, the Solage is a very special place, luxurious, tranquil and truly relaxing, we just loved it.",
5,Simple luxury in Calistoga,"This was our second stay at Solage and it did not disappoint. The grounds are lovely, the service is exceptional, the spa is very nice, the workout facilities are probably the best we have ever experienced at any resort, ever (that says a lot- they even offer TRX classes- unheard of!) and Solbar is amazing. You could spend more to have some more exclusivity, but why? How much time do you really spend in your hotel room when you are in Calistoga? Probably not a lot. You want a nice, comfortable and well-appointed room, great food and spa/workout facilities onsite, and then you want to go taste wine. Solage has it all.",
5,Day of Spa relaxation!,"Beautiful, relaxing with every detail perfect! The spa experience was luxurious and full service. I felt relaxed and pampered. A little more explanation would have been helpful, since this was my first experience of a mud slide but overall a worthwhile experience. Try the refresher drinks at the spa bar they fill you with energy!",
1,Unbelievable,"I was just booking a spa treatment for me and my 2 girlfriends costing $115 each. Just as I was about to hang up, I was told that the hotel has an entrance fee for those not staying overnight at the hotel of $50 each! First of all, I have to give it to the reservationist for letting me know about this fee an not blindsiding me. But, for heavens sake, we are going to use your services and give you revenue! Why be greedy and get more? It's not like I am not spending anything at the hotel! Who knows, we might even get a drink/snack after the treatment but, because of what I think is very poor taste, we are walking away. $50 is such a small amount, it is the idea. So, you can have your hotel and I will take my unwelcome business elsewhere!",
5,Relaxed beauty,"Each individual cottage is beautiful and comfortable. A true California experience. Hot during the day, cool at night, who could ask for anything more. They do have a family pool and an adult pool, but clearly leaving the kids at home is preferred.",
5,Luxurious stay but pricey,"Solage is a lovely resort full of many luxuries, including great linens, spa water at turndown, a fantastic pool and full service spa. We thoroughly enjoyed our stay there, having decided to splurge for two nights at the end of a week stay in CA. The restaurant is very good with an incredible wine list but the meals are overpriced and better options can be found in the town of Calistoga or in nearby St. Helena. My massage and mud bath treatment was very nice but again, pricey. The service was excellent in all areas except the restaurant where we did have to wait several times at dinner for little things like bread service and a refill on water during the meal. Worth a visit if money is no object!",
5,Solage Calistoga,"Solage is one of the best resorts we have ever stayed at. We spent several nights at the establishment and would have loved to spend more. It is a sanctuary, where one becomes so relaxed, it seeps away all stress and eliminates all thoughts of life’s issues. The grounds are very well kept and are truly beautiful. Rooms are spacious and very well decorated. The staff is very courteous, friendly and helpful. Solbar, the restaurant, is amazing; fresh ingredients, very tasteful, and excellent service.
We had the pleasure to meet Mr. Marcus Mueller, the General Manager at Solage, and then it all became obvious. Mr. Mueller is an amazing man, and he is one GM that I would say leads by example. One can actually notice how passionate he is about his staff and the resort.
Yes, we are looking forward to return to Solage; a true sanctuary where one day relieves a lifetime’s worth of stress.",
5,"Great hotel, average spa","There should have been two reviews: one for the hotel and the other one for the spa. Let's start on a positive note - staying at Solage is a splurge, but it worth every penny they charge: sleek and stylish decor, beautiful rooms, probably the best sheets I have ever slept on! Just soaking in their huge mineral pool for few hours seems like a complete vacation.
This time, I decided to enhance my experience by adding a spa package: mud-bath and massage. As the whole place, the spa is beautifully designed. That is pretty much for the positive experience. The service felt rushed and superficial.
We got a package with the silly name, something like ""double your pleasure"" for $475 for two people. The package included a light lunch at Solbar (shared appetizer, two entrees, no alcohol), two 50-minute massages and two so-called ""mudslides"". Mudslide experience is nothing more than a fancy way of stretching a simple 20-min mud treatment into becoming the ""experience"" worth well over $100. After your 20 min are up, you are invited to soak in a mineral ""hydro-bath"" (same water as in their outdoor pool, and pretty much everywhere in Calistoga).
Just to add minutes to your service, you are then guided to relax in a Brookstone-type of a reclining vibrating chair. The whole ritual feels artificial and is totally overpriced, in my opinion.
The shea butter massage was basically a gentle application of a shea butter mixture. Although very pleasant and relaxing, the experience lacked an essential ingredient - the massage itself! The therapist was so arrogant and detached that I did not dare to demand some pressure. To cope with my disappointment, I promising myself that I would never allow to rip myself of another $500, and just tried to relax through the ""treatment"".
Conclusion: hotel - 5 stars, spa - 1 star for relaxing music, averaging 3 stars.",
4,A decent stay,"The hotel is contemporary designed with a touch of nature, conveniently located at the north of Napa. Staff are quite friendly and helpful, apart from the staff at the spa who was a bit blunt, which was the only turn-off. You better book in advance if you would like to experience their spa treatments during your stay, as it was quite full. We have dinner and breakfast at the Solbar, both foods and venue ambience are excellent and really worth a visit, although there are other attractive choices around Napa.",
5,A Perfect Stay,"This was a surprise anniversary get away from my husband and I was totally blown away. From our arrival to our departure everything was perfect. The property give you a sense of privacy yet is very welcoming. Their attention to detail is very evident from your room comfort (great linens & robes) to the interaction that you have with the personnel. We loved the bikes and definitely used them while we were there, they were so fun to ride. Everyone is very friendly and ready to help with anything you need.

The Spa & exercise facility is one of the best that we've seen. Loved the wonderful selection of daily exercise classes (great instructors), the spa changing rooms & amenities, spa treatments (the mudslide treatment is a must do) and the mineral pool and cabanas is the perfect place to relax. Also, hands down the best wifi I've ever experienced at a hotel.

We have stayed at some amazing properties and had great spa experiences, but this one hit mark for on all levels for me and I'm VERY picky. We've already decided that we will return.",
5,"Fantastic ""Leave It All Behind"" Getaway","We were visiting SF for a work trip and decided to stay a couple of extra days in Napa. We received a recommendation to stay at Solage Calistoga and we couldn't have been more pleased. The service is impeccable from the moment you enter the reception area. You quickly realize the ""laid back"" but comfortable atmosphere and you begin to relax immediately. We checked in, were escorted to our room and were very impressed with the individual ""cottage"" suites. A large bedroom with a beautiful view of the grounds, iPads in each room for all your information, large bathroom area and your own personal bicycles outside of your room for all your local ""transportation"" needs. The pool is large and with a multitude of patio chairs and attentive staff to be sure your needs are met.

We took the bikes into town that evening and had a fantastic meal and of course, a wonderful bottle of wine. The town of Calistoga is like stepping back in time with great shops with beautifully decorated storefronts. The people are friendly and welcoming and you can quickly feel at home here.

The spa was a wonderful experience as we booked a couples massage. The attendants were very talented and experienced and we both were completely relaxed after our hour on the table. We didn't get time to enjoy the rest of the spa as a winery tour was in our plans for that afternoon but we could have easily spent the entire afternoon at the spa.

We had dinner at the Sol Restaurant the next evening and the food was fantastic and the service was even better. Our waiter did a wonderful job of making sure we had everything we needed.

If you are looking to get away form the hustle and bustle of the world, I would highly recommend this resort.",
5,Understated Perfection.,"My husband and I celebrated our anniversary at Solage for 3 nights and 4 days. From the minute we arrived, we felt completely welcomed and totally indulged in the kind of way that makes you feel wonderful, not overwhelmed. To a person, we were treated with kindness, generosity and a total commitment to service. The rooms are luscious in a high-thread count kind of way, complete with great pillows, a sumptuous bed, big shower, great toiletries, minted water at night, a perfect morning coffee terrace just for us, and everything else you could want.
The spa...ahh, the spa..Amazing. Even if you just want to float around in the hot springs pool or sit on a relaxing divan and watch the water flow down the sculpture in the center courtyard, you will feel transported. I slept like a baby, and I don't sleep at night very well.
We biked to tons of vineyards (recommend Duck Horn, Round Pond, and doing the salon tasting at Swanson) and hiked up an old mine trail. We swam in the massive and gorgeous Solage pool and dined at the hotel's amazing Solbar. (Have the shrimp wraps for lunch!)
It is clear that the philosophy of the resort is that service matters and that guests are vitally important to the hotel's ability to thrive. Guests will return if they feel had a great time, which we did, and so we will, again and again.",
5,Fantastic mud spa experience,"Went there for a day by the pool whilst on our honeymoon in Napa. Had a mudslide as a couple in a lovely private room where you apply volcanic ash paste mixed with essential oils over your entire body and relax on a heated stone platform. At the end of the mud session, overhead showers rinse it off and you move to another room to soak in a bath with essential oils. Finally, you get to relax in a music chair room. Total relaxation experience worth every penny!",
