Ratings ,Title,Reviews,
4,Stayed 2 nights using credit card reward points,"As stated in the title of this review, we did not use our own money to stay at this spa resort (although we were required to be charged $25/night resort fee during checkout) so please keep that in mind. We made our room reservation approximately 2 months out and had requested early check in (noon). On the day of arrival, they were not able to accommodate this request so we were forced to hang out by the pool until 4pm. Our 2 queen bed unit was located towards the back end of the spa so it was super quiet (compared to those units next to the pool). The room itself was spacious but because it was near the wilderness and next to protected native vegetative grounds, there were occasional bugs that found itself into the room! Bugs such as ticks, spiders, beetles, etc. I wished they would've sprayed for bugs, but I don't think that's an option for them. There a mini-fridge in the room and all sodas and bottled water are complimentary. The same goes for the Nespresso machine and espresso pods. There was supposed to be an ipad in the room to use for order room service, request ice, and other requests but it was missing so we had to phone in our requests. There were 2 bikes located outside of the room for use but we did not use them. Noticed that there were no brakes plus there were no bike locks to use so . . . use them with caution as you are responsible for damaged or stolen bikes I would assume.

We dined at the on property Solbar and chose the $80 four course meal. Each course consisted of about 6 choices. Although this restaurant is a 1 Michelin star restaurant, some of the dishes were on the salty side and didn't blow our minds for the price. Service however was top notch and the waiter/waitress will go above and beyond to please you.

The geo-thermo pool was really nice to swim in at 90 deg F. Water felt like ocean water with no chlorine in it so it was awesome to swim without goggles. This resort did have a separate kid's pool with a jacuzzi nearby for adults to hangout in while supervising their kids.

Exercise classes were offered complimentary as well as borrowing a Mercedes car for the day (although we did not take advantage of these perks).

All in all, this resort was nice, however, I felt that it didn't offer that many activities to do nor was it that big (relatively speaking). Perhaps it needed more dining choices onsite? Would I visit this resort again using my own money next time? Unfortunately, for some reason, this resort didn't wow me enough to justify using my own money.

As a side recommendation, go check out Gott's Roadside diner in St. Helena. Delish burgers and shakes!",
5,Sublime,"Never have I felt so pampered and relaxed than at Solage. This place is the epitome of elegance and casual sophistication. The pools are amazing - especially the geothermal mineral pool, kept at about 90 degrees. The restaurant is top notch. The room and bathroom were sleek and appealingly appointed. Loved the two bikes, the gardens, and the private patio. Staff is attentive yet unobtrusive. Highly recommend.",
5,Fantastic spa and culinary experience,"Lovely resort with great service, food, spa and pool. Perfect location for rest and relaxation that is close to great restaurants and vineyards. Solbar is a must. Body wrap spa treatment was heavenly. Better location for couples versus families.",
5,Fantastic property in a great setting,"We spent a couple of nights at the Solage and had a wonderful time. The first day the weather was not great but the spa facility meant that you could still swim outside in their highly warmed pool. The next two days the weather was great and any of the pools were great. The rooms are lovely with great modern features - though the iPads tend to freeze and don't work particularly well - so for example ordering bed in breakfast was a bit uncertain! The only niggle that we had here was about having to book for dining. Not knowing that the restaurant gets heavily booked by non residents of the hotel we had not booked a table in advance for the nights we stayed. A simple email to all residents at the time of booking could have invited guests to book a table for lunch or dinner. Alternatively setting some tables aside for residents would have been sensible. However, after we complained about having travelled for 4 hours to get to the hotel to be told we could not eat dinner on the property - they did manage to find us a table. Top tip: book your restaurant dinner table in advance otherwise it will be bar food, in room dining or heading in to town.",
5,1 + bonus night,"We made a last minute trip to Napa and after a day of touring and stopping at a few hotels along the way we ended up booking a room at Solage for the night. Since we checked in late we asked and were given a promo price that included breakfast. Our room (a king room) was a bit small, but still nice with a comfortable bed and at the foot of it a place to sit and have a snack. The hotel grounds are expansive, however walking from our room to the restaurant was a series of left and rights that made us feel like we should have dropped bread crumbs to find our way back, especially at night. The service was very friendly and the restaurant service staff were very helpful with menu recommendations. We were only planning on staying a night, but decided during breakfast to spend another night. I went to the front desk and they accommodated us without an issue and while we didn't get our extra special promo pricing they came close which was very much appreciated. The town of Calistoga is nearby and the wineries are not far either. Being on the Silverado Trail allows one to bypass the traffic on Hwy 128. Auberge du Soleil a sister hotel has nicer views from the restaurant, however for this trip the friendly and helpful staff at the Solage was perfect.",
3,Not Clean Enough,"So much is good here -- most importantly all the staff. The grounds are very nice, too. The massages are hit or miss; some very good, others quite average.

They have a cleanliness problem, however. My room was basically clean, except for the bathroom walls. I won't go into details, but not nice at all.

In the pool area the steam room appeared to be clean one day and then the next smelled moldy.

I hope they address these issues and oversee housekeeping more closely.",
4,Great Restaraunt in Calistoga,"Napa Valley has some great restaurants and Solage is one of them. Though not in the same league as the renowned French Laundry which Michelin gives its highest 3 star rating. The Solage hotel, spa and Restaraunt is owned by Auberge which owns Auberge du Soleil just a few miles down the Silverado Trail. Meadowood too is just a few miles south of Solage. So Solage has to compete at a pretty high level both on quality and service and it did not disappoint. We went there for lunch and I had the Bannh Mi sandwich , and my friends had a Falafal Sandwich and another had Salmon. Oh and we started off we a Avacado Gazpacho soup which was excellent. They have a full bar and a good wine list. Indoor and Outdoor seating with heaters for the outside. Service is friendly and fast but not rushed. Highly recommend this place for Lunch or dinner",
5,"If you have the money, then you cannot go wrong here!","Beautiful property. Quiet and yet not far from many things in Northern Napa Valley. However, having a rental car is highly recommended. One surprise here is that the property does have several cars that you can borrow (subject to availability, of course).

Room are all cottages. No elevators!!! Each cottage has 2 beach cruiser bicycles for you to use. Rooms are furnished just right. Even have a private patio with each room. Mini fridge is stocked with water and sodas at no add'l cost. The restaurant, Solbar, is very good.

Service from all the staff was excellent. Would stay there again.",
5,Relaxing as always,"Solage remains the best, most relaxing spot to spend a weekend at in Napa and unwind. The Spa in particular is worth a trip in and of itself. But so is the main pool, the bar lounge and the restaurant.",
5,Family celebration of our Golden Wedding Anniversary.,"We only booked lunch for our special occasion. It was superb.The staff looked after us and made helpful recommendations. Little Tommy the toddler joined his English grand pa and grandma and uncle and auntie all the way from Australia. The he enjoyed the attention of the staff whilst we enjoyed a perfect lunch and superb champers and white wines.
This was a day to remember by us all.
Many thanks to all that made it so.",
5,Perfection in Calistoga,Visited in February with two friends for a girls weekend. We loved every minute at Solage from the lovely glass of wine on arrival to soaking in the mineral pool in the evening to cocktails at SolBar. The cottage accommodations are spacious and have every amenity under the sun. Beds are so comfy. You will want to stay again and again.,
5,Girls Getaway,"I highly recommend this experience for a girls getaway. The service, the spa, the specialness of this place is incredible. Every detail was so thoughtful and even if there was the slightest hiccup it was overcome by the entire staffs responsiveness. I cannot wait to come back with the hubby for more of what this beautiful place has to offer.",
5,Pampering at its best!,"My husband I went here originally to take part in qigong with Linda Burquez. We decided to stay at the Resort and booked a room and a ""mud slide"" treatment. This place has service down! The spa was perfect. Rustic, outdoors and elegance all mixed into one yummy experience. This is a bucket list place if you love spas and service.",
5,"Great service, food and ambiance","Solage is great to stay, spa or just visit for a long fun lunch with friends. I have several friends who are members and I have had some of my favorite Napa valley lunches at Solage. The food is local and delicious and their wine menu is very comprehensive and supplied all the minerals whites and dry rose's we have wanted.",
4,Very private wellness retreat,"Private adequate rooms with free wifi. What really makes it work is the amenities. The superb spa and separate pool areas for families and adults. Cruiser bikes with each studio. Pet friendly. Flat screen TV and pebble stone floored showers are a plus. It is the huge spa with a comprehensive treatment menu, mineral pools, and gym that leave a lasting impression. Very environmentally focused practices throughout the resort. Michelin rated Solarbar restaurant serves healthy ingredient driven fare
Pricey stay but try at beginning or end of season for best rates.",
3,This is a Luxury Brand?,"We've booked a pretty phenomenal itinerary for a meandering LA to Napa Road Trip. I'll try to not act too petulant about my experience with Solage.

1. We're staying at Montage, St. Regis and other 'brands' along our trip. We liked the look of Solage, and the Auberge brand, enough to make it our choice for our Napa leg

2. My wife called with our specific date request (weeknights in Mid May). We were quoted a rate on the phone, were told by a Sarah that she would email the quote (always need to see the fees) and would hold the room for an hour while she reached me for an OK.

3. Within 15 minutes I gave the thumbs up and my wife called to confirm the Reservation. The email with a quote never arrived. When my wife called back, she was told there were multiple Sarah's and asked which one did she speak with (um, maybe the one who quotes Reservations).

4. No Sarah ever turned up. And our room was 'magically' booked in the 15 window wait and the rate went up $50/night. My wife, while frustrated, agreed to the increased rate and booked the room.

5. When she told me about it that night, I asked for her to demand the 'original agreement' or cancel the reservation. She called at 8pm on a weeknight. There was literally no answer. In two phone calls.

6. I immediately booked three nights at the nearby Resort that starts with a B.

7. When my wife called to cancel the reservation at Solage there was absolute disinterest in 'why'.

8. I unsubscribed from the Auberge e-mail list.",
4,Beautiful and Pricey,We came by for Easter breakfast. The grounds are lovely and the restaurant is both upscale yet comfortable. The service was very good as was the food-- but overpriced. Nonetheless we enjoyed ourselves.,
5,Simply Perfect,"Idyllic beautiful hotel in the heart of Napa wine country. Great guests rooms, brilliant facilities and the most amazing, delicious food and cocktails/wine. Can't wait to go back and drift lazily around the property on the bicycles provided, take the complimentary Mercedes out for a trip to the vineyards and enjoy more delicious meals at SolBar.",
5,A class act,"Solage is beautiful, family friendly, and the service is top notch. Even my 8 year old said ""wow everyone here is so nice!"" The lounge and Solbar restaurants have excellent food for adults and kids and easily accommodated our Passover restrictions. As noted the kids pool area is smaller than the main one but still a lot of fun and very warm. Room service brought milk for kids in minutes and remembered our requests the next day. The location is close to many family friendly activities. My only wish is that there were more bedding options for a family than two queens. Highly recommended.",
5,Another blissful solage experience,"As always a top notch, luxurious, delicious experience. Spa and in room dining for breakfast and dinner (restaurant was booked for dinner and it turned out to be absolutely wonderful anyway, served in our room), with lunches at sol bar where they offered us blankets because we sat outside and looked chilly, for two and a half days... I couldn't have been a more blissed out birthday girl. Even in the rain!",
5,First Class Cottages,"We have stayed here several times and it never fails. From the individual cottages to the amazing food and service, it is always a great choice when wine tasting in the Napa Valley. You really appreciate nature in this kind of setting.",
5,Quiet and elegant..,"A perfect family escape for a couple days in a great location on the edge of town.
Could bike or walk into town. No need to leave the resort as it has everything you need to relax and enjoy the great service.
Loved the thermal pools, steam room, and our host Anthony in the spa area was fantastic.",
5,Oasis in Napa Valley,"My wife and I attended a business function at the Solage for 3 days and thoroughly enjoyed the resort. It's a small property with each ""room"" being an individual sort of bungalow (or one of 2 connected together) which gave it a very nice secluded feel to it. The service was excellent from the time we checked in (immediately served a glass of nice quality wine) through check out and every step in between. The bar and restaurant have a very good menu with plenty of healthy and indulgent options. My wife enjoyed her ""Signature Massage"" at the spa and thought it was one of the best she has ever experienced. We would definitely stay at this resort again.

Only one small complaint. There was minimal in room storage. No dressers, just a few small shelves in the closet, and no storage of any kind in the bathroom (although the entire area under the sink was wide open).",
5,Modern Cottages,"We stayed here w/ 4 other couples for 2 nights. We didn't have much time to really explore the resort because we were out at vineyards and it rained the whole time we were there. The services was very cordial and the food was very good at the restaurant. We ate breakfast and dinner, both of which were scrumptious, but very expensive. The rooms were clean and modern w/ tub and shower. I did get the mudslide spa treatment. They give you a tub of mud and you slather it all over and rest for 15 minutes, then a 10 min soak in hot bath, and finally a 10 min sonic type of nap. It was very relaxing. We would definitely stay again.",
5,Laid Back Luxury,"We stayed at Solage on our recent visit to Napa Valley. We prefer Calistoga to the other valley villages. It is quiet and doesn't have the traffic and tourists we found elsewhere in the valley. The Inn is composed of separate cottages each with a private porch and outdoor seating. The cottages are situated in a manner to offer guests privacy and freedom from intrusion by other guests. Each cottage comes with bikes, and dogs are welcome. The resort has a beautiful spa with geothermal pools, yoga studio, fitness equipment and treatment rooms. The hotel also has a junior Olympic swimming pool. Service was friendly and attentive and made for a very relaxing weekend.",
5,"Solage, perfect for dogs and us humans who follow!","My wife and I and our yellow Labrador retriever recently stayed at Solage and the staff made her (our lab) feel as special as we did. Everyone, from the front desk team to the staff at Solbar restaurant, greeted our pup and went out of their way to make our experience enjoyable. Our room was great and the food wonderful. A perfect DogCation for all! From DogTrekker.com.",
5,Great Calistoga resort.,"My husband and I are planning our 4th visit to Solage. Great cottages, outstanding restaurant, beautiful pool and spa, excellent staff! It's a short drive to Calistoga's Main Street and St. Helena. The spa thermal pool is unbelievable. The resort also has a great workout room with state of the art equipment!",
5,Girlfriend Birthday Weekend,"Great weekend stay! She loved it. Very relaxing. Staff friendly and helpful. Mineral pools warm and relaxing. Private male and female pools and steam room were big plus. Great food at SolBar. Mercedes to drive, too. Vroom, vroom!!!",
5,Napa,Excellent resort. Very relaxing. Spa services were great. Not crowded. Beautiful views in the valley. All the staff made us feel welcomed and we hated to leave. Would recommend to anyone going to the valley,
5,True Luxury in Calistoga,"This was my third trip to Solage, and it never disappoints. Gorgeous facility, great food, very nice staff. Total relaxation. Calistoga is less crowded than say, Napa or Sonoma. You can easily ride one of their bikes or go for quiet walks. Spa is veery expensive but worth the pampering.",
5,TOP Notch Hotel & Spa in Wine Country,"My wife and I have stayed here twice in the last 2+ years and it's been awesome both times. For us, service is always above the bar. We arrived this time and it was raining, the valet came out and said ""don't get out - give me your driver's license and I'll check in for you"". So we just hung out; less than 5 min later he came back with keys to the room and a map and we were on our way.

The rooms are more like cottages, most semi-attached to another but no one lives on top of you, and unless you are next to loud crying babies (not a common occurrence I'd imagine here). We had King Beds with fireplace both times. The rooms have been spacious, with a bigger shower and bathroom area than I have at home, and a deck, sitting area with views of vines, trees and mountains. It's nouveau-ish, sleek, finely appointed and straight up comfortable as hell.

Workout room is great - lots of machines of all kinds. And if you go to Solage, you must do a spa. Mud and hot springs is the thing in Calistoga and you can do both here. Relaxing & gorgeously understated and pristine.

Food too is exceptional. Like, reallly, really great. This isn't your run of the mill hotel food. It's a must you eat there once - brunch is great, dinner is unbelievable. And Get the butterscotch pudding. It's ridiculous.

When I travel I tend to travel nice. And my wife and I think Solage is in our top 5 nicest hotels we've ever stayed at.",
4,Nice stay in the valley,"We had a nice stay at the Solage in Calistoga. My husband was running the Napa Valley Marathon, and the Solage is at the starting line (how convenient to roll out of bed and right to the starting line). The rooms are designed well, and quite comfortable. Unfortunately we were assigned a room close to the restaurant and could hear the bass from the music at Solbar. The staff was able to accommodate a move for us after the first night. The second room was larger than the first (which was appreciated), however it smelled like a previous guest had smoked in the room. The spa and mineral pools were fantastic! We were only able to dine at Solbar for breakfast, as we had made other arrangements for dinner. Breakfast was solid (albeit on the spendy side - $7.00 for an english muffin?). The staff is warm and very accommodating. We were greeted by name, which was a nice touch. I'm sure we'll be back!",
4,Good location and great room but service was a bit off,"My partner and I stayed there twice. After the first stay 18 months ago, we couldn’t wait to go back there. It was so perfect. But at the recent stay, I felt service was a bit off.

Prior to check-in this time, I asked a quiet room. But the first person who checked us in, she assigned a room right next to Brennan St.. It was noisy every time a car drove by even with all windows closed. So, we had to go back to the front desk to change the room. (The 2nd person who help us explained that the entire block of units in the west side were considered “quiet rooms”. I think they should review that since it was definitely not quiet.) But changing the room was smooth.

The room was very nice. Only what I felt missing were a hand shower, a double-sink and a view from a bath. Everything else was great.

For our room, there was only one bike for two of us. I called guest service and the person who I talked said that she will have someone bring another one by next morning, but the 2nd bike never arrived during our stay...

I enjoyed in-room breakfast very much. I never expected much from room service, but at the Solage, it was surprisingly delicious.

As for dinner, I probably don’t want to do dinner at Solbar again. Service was extremely slow, and food didn’t taste special.

Spa service was very good.

It would be great if the Solage provides a ride service to local businesses such as wineries and restaurants. Since it was too cold to walk or bike, we had to call Lyft/Uber to go to a local restaurant for dinner, which was kind of silly because it’s just 5 mins ride but the car had to drive up nearly 20 mins to get to the Solage.",
5,Luxurious Comfort,"We stayed one night during a wine country weekend. The room (actually a cabin) was large, comfortable, and luxurious (especially the bathroom). Location is an easy 2 mile walk or bike ride from downtown Calistoga, where we went for breakfast. Definitely try Calistoga Roastery -- amazing coffee!) If the weather had been warmer we would definitely have enjoyed sitting on the pretty patio in front of the cabin and tried out the free bikes waiting at the room. Loved the spa -- mudslide treatment was truly relaxing, and the jacuzzi was great after a long day of being out and about. This hotel was a splurge for us but we loved it!",
4,Lovely Getaway But Service Slipping,"We love Solage and have been going there a few times a year ever since they opened. It has everything from great rooms/cottages to a great spa and wonderful pools. Solbar, the restaurant, has very good food and it is nice not to have to leave the property for dinner. We really enjoy the fitness classes and the instructors are terrific. On this visit, however, the property seemed to be understaffed in all key areas, the front desk, the spa, and the restaurant. We called guest services five different times during our visit and the phone was never answered on three of them. On one of them, they recommended that an engineer come by our room and although we waited for over an hour, the person never showed up.
Each time that we called the spa to sign up for classes, we were put on hold for long periods of time, and when we went by in person to sign up, the staff was not helpful and appeared more interested in their computer screens even though we were the only people at the desk.
We also noted this lack of staffing in Solbar where dirty tables were left uncleared in the restaurant for a long period of time at a peak period (around 7pm). This was despite the fact that the staff that was there remained pleasant and were working very hard doing their best to get to everything. The food quality is still good, but not up to the standards of previous visits. Also, the class description for ""Yoga Hour"" should be ""Hot Yoga"" since they really heat up the room and we didn't know what we were getting into.
Despite all these things, we love staying at Solage and hope that they will fix the staffing issues before our next visit.",
5,Wonderful Wine Country base,"Stayed here the week between Christmas and New Years and highly recommend it. We felt like with 3 wineries booked each day and dinner out most nights we didn't get to make use of all the amenities the hotel offers. However we still very much enjoyed our stay. The cabins are great, very private, and love the complimentary water and sodas Each day as well as espresso machines. Great bath and shower , rooms are so nicely done. We did go to the adults only hot tub (pool sized) one afternoon and it was great. Also ate at restaurant once for dinner and once for brunch and both meals were
Excellent. Calistoga is a great base for exploring wine country and Solage was an excellent choice for us! Can't wait to come back!",
5,Another great review for Solage,"Even when it's raining, you can still enjoy your stay with heated pools and strong heaters in the cabanas. Wonderful trip. With the complimentary breakfast on the last morning, we were able to leave on a high note.",
