Ratings ,Title,Reviews,
5,Hard to beat getaway location...,"I only stayed the one night with my family at Solage, but it was perfect in every way. Rooms are super-spacious and very well equipped. Everything worked, including WiFi - staff went way and beyond to do everything possible to make our stay memorable, and for all the right reasons. If you find the need to get away and decompress, or catch up on life, then you'll find Solace hard to beat.",
5,Paradise in Calistoga!!!,"Returned from the most amazing trip to Napa area. The Solage could not have been a better place for girls trip. Everything was absolutely perfect!! Stayed in the Silverado suite and was completely happy with everything about the room. Room was very comfortable and had large spacious bathroom with plenty of closet space. The grounds are meticulously kept and the entire resort has such a relaxed feel. Let me give a big thumbs up to the entire staff who were all so friendly and helpful - they all really make you feel welcome and special. Want to give a special thanks to Joe the Director of Operations who could not have been more helpful and pleasant - he really put our stay over the top!!!

While at the resort we took a few of the many fitness classes offered which was such a wonderful treat and the classes were great. We also utilized the gym which was perfectly equipped and allowed us to not miss a workout. The resort is also so close to hiking trails which was a great way to start our mornings - you can take the bikes from your room right to trails.

Now let's talk about the spa..... OMG had weekday sampler treatment and it was probably the best treatment I have ever had ( And I am definitely a spa enthusiast)!! The whole experience was top notch. The treatment rooms were clean, beautiful and just a tranquil, relaxing experience.

My only complaint and its not really a complaint is I was not happy with menu at Solbar they had very limited options especially for vegetarians and there was no good lunch options for my group. Michael the Solbar manager was an absolute angel and was able to help up get a meal that we were so happy with on our day of arrival when we were absolutely starving! Just another example of how fantastic the staff at the Solage is.

I will be definitely be returning to the Solage next year - just need to now figure out a way to stay longer because this place is really a relaxing paradise.",
5,"Pretty resort, comfortable luxe room","We were so happy to arrive and find extremely comfortable beds after two nights on the coast at another hotel with uncomfortable beds. The spacious room was immaculate, as you would expect at this price, as was the service. Reception was welcoming, offering us a glass of wine at check in, and a few things requested from housekeeping and room service arrived very promptly. We took advantage of a car offered for guest use (my husband is a car fanatic and could not resist) and went a few miles down the road to our favorite place in Yountville for some fresh oysters. We had a late dinner reservation (830 is late for us) at Solbar as that was all that was available but it worked out fine after our later afternoon snack. Dinner at Solbar was a treat. We can't wait to go back and stay longer.",
5,Unmatched Customer Service and Care,"There is no place in the world that I have traveled where I get quite this level of service, care and responsiveness. I keep coming back because this place knows how to treat you. From the 3 menu's to choose from, the 3 pools, the killer customer service that know you by NAME... it is like coming home - but to a home you never had!",
5,A wonderful stay!,We stayed at Solage to celebrate my husband’s birthday with our dog. It was a wonderful experience. Every detail was well done and we cannot wait to return! We had a fabulous experience at the spa and a beautiful meal at Solbar.,
5,"Solage=Bliss. Don't think, just book and go","We just returned from 2 nights at Solage and are still feeling the effects. The service is impeccable, personal, thoughtful and just the right amount of attention. We were celebrating a special occasion and there were special touch points during our stay where staff made an effort to commemorate and note the occasion. We were surprised more than once with these personal touches and it was so appreciated. We never left the property and enjoyed 4 luxury spa appointments and ate every meal on-site, so.I can assure the exquisite service extends to every facet of the resort. The details are what you really notice and you will be surprised and delighted by these during your stay----walking along the path to your room and you pass by a hot apple cider bar, with candied ginger and cinnamon sticks. A fresh bottle of water delivered to your room for turndown. A beautiful piece of chocolate on a lovely ceramic dish by your bedside. Oh, and the robes provided in your room feel like you are wrapping yourself in a fluffy cloud. The linens are equally as sublime and the bed, good god, the bed is amazing. The rooms themselves are perfectly designed and feel private, spacious and every last want or need in a hotel stay is not overlooked. In short, go. You will become a lifetime fan of this resort without a doubt. We are coming back next month and I've got the date circled on my virtual calendar!",
5,Worthwhile Stay,"Relaxing locale, delicious food, unbelievable staff, cozy suites with beds a mixture of a cloud and a hug, remarkable spa and just an all-around phenomenal atmosphere... Solbar definitely met all our dining needs from formal dinner, to breakfast outside, to an afternoon snack and cocktail to in-room dining- it was perfect! The Bathhouse was amazing and Marina made our experience even better!",
5,Perfect weekend getaway!,"My husband and I decided to drive 2 hrs to Calistoga for a weekend of R & R and Solage had everything we were looking for. Beautiful resort, with a spa and restaurant, friendly staff, lovely room, comfy bed, and plush, warm robes for the cool Calistoga morning. Pure relaxation.

We enjoyed the Spa prior to checking in. We enjoyed an amazing couples massage from Cindy and Rebecca. We then headed over to the geothermal pool and enjoyed some delicious fish tacos from Solbar while waiting to check-in. Fortunately, the resort was able to accommodate an early check-in. Thank you front desk!

Our dinner at Solbar was delicious. We had the pulled burrata, steelhead salmon, and grilled pork chop. We were initially told that we would be placed on a waitlist since there weren't any reservations available, but we walked over to Solbar around 6pm and were seated immediately. Our server, Laura, was outstanding!

We didn't make use of the bikes outside of our room, but had we stayed an another night, I would have definitely explored the resort on bike. Solage is a little on the pricey side, but in the end, we found it to be worth every penny.",
5,Girls weekend,Fantastic stay at Solage will Be back again soon. I’ve been here many times before and is certainly my favorite get away place. The pools and spa are clean. Love the food and service at Solage. Will be back soon,
5,Worth every penny,"This was a special trip for us and it did not disappoint. The staff was friendly, the property gorgeous, and the food was fantastic. The spa experience was clean, relaxing and stress-free. It was worth every penny and I would do it again if I could!",
5,Extraordinary world class resort,"The most magical place in California. A must for anyone that’s traveling to Napa Valley and Calistoga. I highly recommend this resort. The service is impeccable, dinning is fabulous, and the service is unforgettable.",
5,Peaceful Elegance with superb food and service,"We had such a great relaxing escape at Solage. Our room was very comfortable and with a view. The patio outside faces trees and park like area for the kids and/or pets to play. Inside the bedding is wonderful, the Nespresso coffee & tea machine is a real treat. The towels are large and lush which match the bedding and robes. To top it off, we were greeted with a wine and fruit tray accompanied by a nice welcome card. We will be coming back.",
5,"Wonderful Staff, beautiful resort","Almost everything about this resort is 5 stars. The beds are extremely comfortable, the pillows are probably the best we have ever had at any luxury hotel and the staff is very nice and accommodating. There were only a few items I would change or fix. The heating system is very difficult to operate. You have to use your room key and the system does not remember your own personal setting for very long. It will revert back to the preset temp of 72 in the middle of the night and then it does get a bit warm. I had to wake up numerous times in the middle of the night to readjust it. Our trash we left on the counter wasn't cleaned up each day. We left dishes for them to clean but they didn't remove them. I would also provide two hands instead of one for both sinks. Everything else was just wonderful!! We will definitely stay again and try all of the other amazing amenities the resort offers when the weather is warmer. The room service food isn't as good as the restaurant. For the price, I would say just go to eat at the restaurant for breakfast instead of room service. Overall we loved our stay. Just a few small items they could do differently or fix.",
5,complete luxury,"we stayed to celebrate 3 birthdays. The staff at the solage were so thoughtful. We were greeted with chocolate chip cookies, milk, wine and a fruit bowl and card wishing us happy birthday. in the crib was a tiny stuffed animal with a solage t-shirt for our baby, sunblock and wipes. the attitude and service of the staff were incredible. everyone was incredibly polite, friendly and thoughtful. We loved the trip and will be back! we've stayed at many nice resorts and Solage is our favorite.",
5,Relaxation at its finest,"We were blown away by the beauty of the property, the luxury of the amenities (the mattress! the sheets! the pillows! the duvet! the towels! etc!), the courtesy of the staff, the quality of the food, the relaxation in the mineral pool, and the list goes on and on. We had a wonderful time.",
5,Luxury at its finest,"I write this review truly pleased. As a person also in the customer service business I know things are supposed to go right every time at least the customer facing things. But I also know that just isn't true every time.

I had what ill call a series of pretty severe missteps in my experience here. But I can say with certainty the people in charge of righting those wrongs stepped up and did. Over the top in fact.

If you are looking for some surface level reviews where people tell they had a good time most of the time you'll find them here as well, but I am here to tell you that when things go wrong (and we all know they do now and then) this is a facility, and a staff that will do everything it can to make sure they fix it. Nice job Solage team. Keep it up and I'll see you next time I'm looking for a relaxing stay.

High end place, top notch staff, top notch amenities. The spa deserves its own 5-star review as well!",
5,Winter Perfection,"A lovely resort, especially soaking in the natural hot springs as the rain poured down. There were plenty of large and warm towels awaiting us. Then into the spa for a steam, and a shower with all the amenities including comfortable bathrobes. The swim in the olympic pool, that i had entirely on my own, was another highlight. All of the food was delicious. Friendly staff, but not too friendly; so our privacy was preserved. Rosemary is all over the property which smelled great in the rain.",
5,Luxury in the midst of a storm,"Our reservation date landed in the midst of a storm. We thought about cancelling our trip, but so happy we didn't! Solage was a luxurious oasis in the middle of the storm. They did everything to make our stay warm and comfortable despite the inclement weather. They provided cabanas in the spa pool area, had transportation to take us to and from our room to the spa, etc. The staff was top notch and we enjoyed every minute of our stay.",
5,Doesn't Get More Personalized Than Solage,"Solage is a high end boutique resort that excels in everything they do. The property is very clean and elegant. You won't find a piece of trash anywhere. The staff are exceptional and don't change over the years. Management must be treating their staff well. There are multiple warm pools, a Michelin star restaraunt on site that's casual and many amenities. I am suprised they don't charge closer to $800 a night for a room. Solage is a Gem.",
4,"Another great stay at Solage, your Napa Dog Friendly location!","Solage is our ""go to"" location in the Napa Valley for a dog friendly getaway; probably the *best* dog friendly hotel in the whole area, we go there regularly with our two 60lb shepherd and collie.

The Silverado Suite, while the most expensive, is ideal for your furry companions, since unlike all the other room types, the ""back yard"" of the suite is fully enclosed thus you can let your dogs ""off leash"" in the room, and allow them to roam around the ""back yard"" as they please.

As for dining, you can sit outdoors at Solbar with your dog, or if you like take a 15 minute walk into Calistoga itself and sit outside at the wonderful Evangeline's.

Solage charges $100 per visit as a pet fee, which includes beds, bowls, treats and poop bags, which are also available around the resort itself...

We cannot recommend this place too highly for those of you who want to enjoy Napa
(well Calistoga) with your beloved dogs in tow!",
5,Perfect getaway – amazing food and resort!,You can't go wrong with the Solage! Bed and linens are super comfortable. Food is delicious. Property is beautiful and the spa/pool is absolutely relaxing! Make sure to book your spa appointments and dinner reservations early.,
5,"Solage in Calistoga, perfect getaway!","Amazing, unpretentious and completely pampered experience at Solage in Calistoga!! From the room to the facilities and especially the mineral pools amd spa!! Would go back and I will, in a heartbeat! So needed and frlt completely refreshed!! Thank you Solage!",
5,A week at Solage,"Excellent location, staff, services and amenities. Our 4th visit and we will return for the next Christmas week. Of particular importance to me was the friendliness and acuity of staff in every department.",
5,A girls celebration,"Solage is an awesome hotel. A glass of wine when u arrival. A bottle of wine, nespresso coffee and a fridge full of drinks! Exercise classes outstanding. Yoga everyday! So quiet and peaceful! Worth every penny!",
5,The ultimate in comfortable luxury,"A recent weekend trip to Solage to celebrate a birthday was prompted by a special ""Get back to Napa"" offer following the recent firestorm in the area. It couldn't have been more relaxing -- the studio was spacious and private, the amenities excellent, and no detail had been overlooked to make our stay magical. Even the dog was happy with the special bed and treats that welcomed him at check in. The room was so comfortable that we had most of our meals through Room Service, including some killer butterscotch pudding made with Macallan 18. One day we walked into Calistoga, a 20 minute stroll from which we returned with shoes and books: what could be better?",
5,"Great Service, Amenities and Rooms","Solage is an amazing property. It's in the heart of the Wine Country, surrounded by vineyards and mountains. The studios are chic and modern. The restaurant is first-class and so are the thermal pools and the spa. But nothing tops Solage's swimming pool -- it's over 120 feet long and framed by majestic palm trees and olive trees.",
5,Dream resort,"The solage is one of the best places we’ve stayed. The rooms are elegant with excellent coffee, the most comfortable robes and a great shower. There is also a fully stocked mini bar and the most excellent chocolates for turndown service. Rooms come with bikes and it is also walking distance to downtown Calistoga. The solbar offered great drinks onsite with a great outside patio with fire pit. We didn’t have time to try the pool or spa but both looked amazing.",
5,A relaxing spa birthday getaway,"Been wanting too visit wine country for my birthday and searched for a nice resort with spa services and excellent food. So happy that we stayed at the Solage because the experience was excellent! From the staff, private suites, complimentary rental, layout of the property, food, bar, restaurant, and spa exceeded my expectations, The mudbath spa treatment was so relaxing and rejuvenating. Will definately be coming back again,",
5,Perfect getaway,"Spent a night at solage for my birthday. Can’t recommend it highly enough. Property was beautiful, geothermal pools were incredible, restaurant was excellent and staff was so kind. All in all a really wonderful stay in the awesome town of Calistoga. Go and support wine country!",
5,WOW! What a hotel & spa!!!,"This was one of the most serene and high quality hotels I’ve visited in America. It lived up to and exceeded its reputation. Everything was A+++

We stayed in a king studio. It was spacious and in great condition. Very cool shower set up: I think it was made of some type of rock. I hadn’t seen one like that before.

Spa was awesome even in the middle of winter. Mud slide was cool, and definitely worth getting the longer one as even that felt quick. I wish I could buy the relaxation chair.

Food was phenomenal, both the included room service breakfast and also the 5-Star Napa restaurant.

We need an excuse to come back!!!!",
5,SO MUCH LOVE!!!,"This was our second stay at Solage, and it was even more amazing than I remembered. The service level is impeccable. Staff is courteous, the grounds are gorgeous, the beds are beyond comfortable. The food was excellent. They had chai outside during the day, which I just loved. I can’t say enough great things. We also both had massages at the spa, and picked up some great/cute items from the shop in the spa. Might have gone a little overboard, but such great stuff! Will remember this as one of the best trips of my life. Thanks Solage!",
5,Lovely respite from the world in the heart of wine country,"Calistoga is a little further north than much of the Napa Valley, so it's a little more quiet and less crowded up here. The placid, tree-lined grounds are welcoming and encourage guests to take a stroll, but each room also gets two bikes to pedal about if you prefer. (Pump up the tires at the bell desk, though.) The friendly staff will make every point of your visit enjoyable. I've stayed here several times and always liked it. There's a huge swimming pool I didn't swim in (but wished I had) and the food in the restaurant is first class. It's a luxury hotel so you're looking at around $500 a night but compared to other similar hotels up here - most of which are also nice - it's worth it. I would have designed the room a little differently to be more open and I might have chosen an interior color different from the institutional green they have, but that's really nitpicking. This is a lovely part of California and this hotel is a nice base from which to explore it. I would go back again without hesitation, and probably will soon.",
5,Luxe Without The Attitude,"Beautiful place for a relaxing Saturday in the sun. Many spas like this are a bit snooty but not Solage. Great vibe, excellent service and the food and bev were on point. The shrimp lettuce wraps were delicious as was the rose' that washed them down. We'll be back.",
5,Endless Relaxation,"Solage is always the perfect place for a relaxing getaway, there is nothing better than breakfast at Solbar, relaxing at the spa, and enjoying the geo-thermal mineral waters. You will surely leave rejuvenated.",
5,Relaxing and restorative,"This was our third time at Solage and the place never disappoints. It has a tranquility about it that allows you to completely relax and everything is set up for maximum ease and comfort. The lap pool is fantastic, whether you actually want to swim laps or just lounge next to it, and the spa facilities provide everything you need to unwind completely.",
5,Great place to stay,"We love Solage. The property is beautiful. It has all the things we look for - spa, exercise, awesome restaurant. All the staff is friendly and inviting. The room was modern with a soaking tub and steam shower, we had a semi-private patio.",
5,Great honeymoon escape,"The staff is exceptional, as are the grounds, and the on-site restaurant, Solbar. We spent 1 entire day at the spa, and loved every second of it. The concierge set us up very nicely with great ideas of things to do. Very happy. Only downside is this place is a bit pricey, but you definitely get what you pay for.",
5,1st Class all the way!!!,"This was such a treat! The Spirit of Napa special made it possible for my girlfriend and I to have a wonderful two days in the wine country. The resort is absolutely gorgeous. Each studio is tucked away with it's own private porch. We had a view of a beautiful, majestic oak tree. We were welcomed with a glass of wine and a smile!! The rooms are very large, bed comfortable, double sinks, Nespesso machine, fresh half and half, turn down service, robes, and a wonderful spa...we spent a rainy afternoon in the two hot pools, steam room and reading area. Highly recommend this place!!",
5,We loved this gorgeous resort! Two Michelin Star Restaurant Solbar was loved as well! We'll be back!<3,"Not long after the October 2017 fires that devastated Napa and Sonoma, we still wanted to visit and enjoy our previously planned wine country vacation. We arrived at Solage and were very happy with what we saw......a beautiful resort with a spa and an amazing restaurant. Upon our arrival, the offered to pour us a splash of wine at check-in. We arrived a bit early so they suggested we have lunch at their restaurant, Solbar. We didn't know at the time what a great suggestion that was! We sat and looked at the beautiful surrounding at this restaurant...the outside, the inside......it was all so impressive! Then the friendly and helpful service from the waitstaff! It only got better because then there was the beautiful food! OMG! We shared the tuna sliders and a few other appetizers! We didn't even eat that much but because it all tasted so delicious that we were satisfied and very happy! They poured us a delicious and complimentary glass of sparkling wine. Not long after our beautiful room was ready. Clean, updated, large and comfortable. Bicycles for our use outside were a nice touch. So, we ate three meals in a row at Solbar! Two Michelin stars! Every meal better than the one before! If anyone is wondering if it's time to go back to the wine country......go now! Before it gets too crowded again....all wineries are open and happy to have you. Solage was one of the best hotels we've ever been to. It's part of the Auberge collection. An elegant-hip place to be....one of the best in Napa! Hurry and go!!!!!",
5,Grand Experience,"What a wonderful place to stay! Breathtaking views, rooms are studios so you have personal space. The SPA is wonderful. The food is phenomenal. The service is white-glove and the optional Mercedes Benz program use is a wonderful addition. You truly get what you pay for here!",
5,Chic high class yet casual getaway,Loved this place! We’ve always stayed down valley while visiting Napa Valley. This trip we decided to go north and found the Solage. This place offers a casual chic vibe with super nice cottages. The fitness area and outdoor pools were great as we were able to get a workout in everyday before starting our wine tasting. The staff was super friendly and really have zero complaints. We will be back.,
5,"Kid AND dog/puppy friendly, in the wine country?!? Yes!","Six years ago I went looking for a peaceful retreat where my husband, who had just had a heart attack, and our 5 year old daughter could celebrate his life and his turning 50. That was six years ago and we go back to Solage every chance we get. Finally we had found a place in the wine country where we didn't feel like we had to apologize for wanting our young daughter along. It felt like a miracle. Then, last spring we rescued a puppy, Larry. We already had our Solage get-a-way planned with friends, so we thought, okay, they say we can bring dogs! So we brought our 11 week old rescue along for the ride. Solage was AMAZING! Not only did they welcome us and our friends, but Larry was enthusiastically welcomed by every single person who worked there. If you're looking for a first class get-a-way in the wine country to celebrate friends, family (yes, that includes our dogs) and life, where you are welcomed into a world of relaxation, book Solage in Calistoga. You won't be disappointed.",
5,"Amazing property, superb service and great time to visit!!","Nestled in a quiet area walking distance to Calistoga my wife and I returned to Solage, an amazing place to relax, enjoy its well known spa and their incredible pool. No matter what we did, we enjoyed the place with its outstanding service and food.

My wife and I hesitated driving to Calistoga due to the recent fires. The truth is that, even though the city was evacuated, it was all a precautionary move as one cannot see any damage at all from Solage nor the town. We were greeted by beautiful sunny days and spectacular views of the grapes turning to their fall colors. This site is almost as beautiful as visiting the fall back East.",
